<?xml version="1.0" standalone="no"?>

<!DOCTYPE caldavtest SYSTEM "caldavtest.dtd">

<!--
 Copyright (c) 2006-2016 Apple Inc. All rights reserved.

 Licensed under the Apache License, Version 2.0 (the "License");
 you may not use this file except in compliance with the License.
 You may obtain a copy of the License at

  http://www.apache.org/licenses/LICENSE-2.0

 Unless required by applicable law or agreed to in writing, software
 distributed under the License is distributed on an "AS IS" BASIS,
 WITHOUT WARRANTIES OR CONDITIONS OF ANY KIND, either express or implied.
 See the License for the specific language governing permissions and
 limitations under the License.
 -->

<caldavtest>
	<require-feature>
		<feature>carddav</feature>
	</require-feature>

	<start/>
	
	<test-suite name='OPTIONS header'>
		<test name='1' ignore='yes'>
			<description>OPTIONS DAV: header does not contain extended-mkcol</description>
			<request>
				<method>OPTIONS</method>
				<ruri>$addressbookhome1:/</ruri>
				<verify>
					<callback>header</callback>
					<arg>
						<name>header</name>
						<value>*DAV!.*extended-mkcol.*</value>
					</arg>
				</verify>
			</request>
		</test>
		<test name='2'>
			<description>OPTIONS Allow: header does not contain MKCOL</description>
			<request>
				<method>OPTIONS</method>
				<ruri>$addressbookhome1:/</ruri>
				<verify>
					<callback>header</callback>
					<arg>
						<name>header</name>
						<value>*Allow!.*MKCOL.*</value>
					</arg>
				</verify>
			</request>
		</test>
		<test name='3'>
			<description>OPTIONS Allow: header does not contain MKCALENDAR</description>
			<request>
				<method>OPTIONS</method>
				<ruri>$addressbookhome1:/</ruri>
				<verify>
					<callback>header</callback>
					<arg>
						<name>header</name>
						<value>*Allow!.*MKCALENDAR.*</value>
					</arg>
				</verify>
			</request>
		</test>
	</test-suite>

	<test-suite name='MKCOL with body'>
		<test name='1'>
			<description>MKCOL with correct request body</description>
			<request end-delete='yes'>
				<method>MKCOL</method>
				<ruri>$addressbookhome1:/adbktest1/</ruri>
				<data>
					<content-type>text/xml; charset=utf-8</content-type>
					<filepath>Resource/CardDAV/mkcol/1.xml</filepath>
				</data>
				<verify>
					<callback>statusCode</callback>
					<arg>
						<name>status</name>
						<value>403</value>
					</arg>
				</verify>
			</request>
		</test>
	</test-suite>

	<end/>

</caldavtest>
