<?xml version="1.0" standalone="no"?>

<!DOCTYPE caldavtest SYSTEM "caldavtest.dtd">

<!--
 Copyright (c) 2006-2016 Apple Inc. All rights reserved.

 Licensed under the Apache License, Version 2.0 (the "License");
 you may not use this file except in compliance with the License.
 You may obtain a copy of the License at

  http://www.apache.org/licenses/LICENSE-2.0

 Unless required by applicable law or agreed to in writing, software
 distributed under the License is distributed on an "AS IS" BASIS,
 WITHOUT WARRANTIES OR CONDITIONS OF ANY KIND, either express or implied.
 See the License for the specific language governing permissions and
 limitations under the License.
 -->

<caldavtest>
    <description>Emulate the common behaviors of the AB client</description>

    <require-feature>
        <feature>carddav</feature>
    </require-feature>

    <start/>

    <test-suite name='Account setup'>
        <test name='1'>
            <description>PROPFIND principal - no authentication</description>
            <request auth="no">
                <method>PROPFIND</method>
                <ruri>$principal1:</ruri>
                <header>
                    <name>Depth</name>
                    <value>0</value>
                </header>
                <data>
                    <content-type>text/xml; charset=utf-8</content-type>
                    <filepath>Resource/CardDAV/vab-client/1.xml</filepath>
                </data>
                <verify>
                    <callback>statusCode</callback>
                    <arg>
                        <name>status</name>
                        <value>401</value>
                    </arg>
                </verify>
            </request>
        </test>
        <test name='2'>
            <description>PROPFIND principal - with authentication</description>
            <request>
                <method>PROPFIND</method>
                <ruri>$principal1:</ruri>
                <header>
                    <name>Depth</name>
                    <value>0</value>
                </header>
                <data>
                    <content-type>text/xml; charset=utf-8</content-type>
                    <filepath>Resource/CardDAV/vab-client/1.xml</filepath>
                </data>
                <verify>
                    <callback>statusCode</callback>
                    <arg>
                        <name>status</name>
                        <value>207</value>
                    </arg>
                </verify>
            </request>
        </test>
    </test-suite>

    <test-suite name='Polling'>
        <test name='1'>
            <description>PROPFIND addressbook home</description>
            <request>
                <method>PROPFIND</method>
                <ruri>$addressbookhome1:/</ruri>
                <header>
                    <name>Depth</name>
                    <value>1</value>
                </header>
                <data>
                    <content-type>text/xml; charset=utf-8</content-type>
                    <filepath>Resource/CardDAV/vab-client/2.xml</filepath>
                </data>
                <verify>
                    <callback>statusCode</callback>
                    <arg>
                        <name>status</name>
                        <value>207</value>
                    </arg>
                </verify>
            </request>
        </test>
    </test-suite>

    <end/>

</caldavtest>
